0,1,2
"feed material at the right time. This is compared to subtractive machining, in which the tool must make contact in an",,
undesired region in order to have more material removed than planned. Part scanning and comparisons likes these,,
serve as relatively quick checks to confirm the additive process deposited enough material.,,
,Figure 15. Comparison of Design Model (CAD) and post EBF3 Structured Light Scan Data Outer Mold,
"Lines to Check for Minimum Material in All Locations. [Courtesy of Will Brandsmeier, NASA MSFC].",,
