0,1
,An alternate version of META4 has been designed to create a smaller thruster for potential engine applications.
"The inner diameter (I.D.) of the META4 chamber at the injector end is close to 6”, in order to use an available, high",
performance injector developed under previous LOX/methane technology programs at MSFC. META4x4 uses an,
"injector end I.D. of 4” to create the same design and operational features as META4, but packaged with a smaller",
"injector that still allows 4000 lb thrust at a slightly higher chamber pressure. The first unit of META4x4 is expected
f",
to be available in late 2017.,
