0,1
"preparing a pre-ceramic slurry
F1 consisting of a solvent polymer and a
ceramic powder","inspection of incoming raw materials for
Q1
pre- ceramic slurry"
"coating of the T 800 fibres with one or
F2
two pyrolytic thin C-layer",Q2 inspection of incoming T 800 fibres
"manufacturing of the prepregs,
simultaneously with the infiltration of the
F3
continuous carbon fibre rovings with the
polymer slurry, prepared under F1","Q3 inspection of slurry, prepared under F1"
"manufacturing of the laminates in
accordance with the stipulated prepreg
F4 layer-lay-up, shaping the laminates and
joining on the mould tool to form the
integral structure",Q4 inspection of fibre coating
"vacuum bagging of laminates on mould
tool and curing in autoclave to cross-link
F5 the polymer and to form a consolidated
fibre-reinforced, powder-filled polymer
matrix composite ‘green body’","inspection of prepreg quality, fibre
Q5
content"
"preliminary shaping to required outer
F6
dimensions","inspection of lay-up of all layers, vacuum
Q6
bagging of laminates on mould tool"
"pyrolysis in inert gas to convert the
F7
polymer into ceramic matrix material","inspection of curing in autoclave data
Q7 and dimension control and NDI on
‘green body’"
"liquid infiltration and re-infiltration of the
F8
porous CMC via the polymer route","inspection of CMC parts after first
Q8
pyrolysis, test of witness coupons"
